{
  "event_id": "3b0d6f0e-8c1a-4f53-9a57-1e0b9b5a7c01",
  "event_type": "SaleConfirmed",
  "schema_version": 1,
  "aggregate_id": 1201,
  "occurred_at": "2026-10-15T15:04:05.123456Z",
  "payload": {
    "sale_id": 1201,
    "source": "admin",
    "subtotal": "25.05",
    "total_discount": "1.00",
    "total": "26.79",
    "customer": {
      "id": 55,
      "name": "Construcciones Andinas S.A.",
      "tax_id": "1790012345001",
      "tax_type": "RUC",
      "email": "compras@construccionesandinas.ec",
      "phone": "022345678",
      "address": "Av. 10 de Agosto N24-56, Quito"
    },
    "items": [
      {
        "product_id": 101,
        "sku": "MART-16OZ",
        "product_name": "Martillo de uña 16 oz",
        "quantity": 2,
        "unit_price": "8.500000",
        "discount": "10.00",
        "tax_code": "VAT_15",
        "tax_amount": "2.295000",
        "subtotal": "15.30000000",
        "invoice_discount": "2.31",
        "invoice_base": "14.69",
        "invoice_tax": "2.20"
      },
      {
        "product_id": 102,
        "sku": "CLAV-2-1KG",
        "product_name": "Clavos de 2 pulgadas (1 kg)",
        "quantity": 3,
        "unit_price": "1.250000",
        "discount": "0",
        "tax_code": "VAT_15",
        "tax_amount": "0.562500",
        "subtotal": "3.750000",
        "invoice_discount": "0.15",
        "invoice_base": "3.60",
        "invoice_tax": "0.54"
      },
      {
        "product_id": 103,
        "sku": "ABON-ORG-5KG",
        "product_name": "Abono orgánico 5 kg",
        "quantity": 1,
        "unit_price": "6.000000",
        "discount": "0",
        "tax_code": "VAT_0",
        "tax_amount": "0.000000",
        "subtotal": "6.000000",
        "invoice_discount": "0.24",
        "invoice_base": "5.76",
        "invoice_tax": "0.00"
      }
    ],
    "payments": [
      {
        "method": "CASH",
        "amount": "20.00"
      },
      {
        "method": "TRANSFER",
        "amount": "6.79"
      }
    ]
  }
}
